{
  "bindings": {
    "base_card_sha256": "6f0bfadd9f07bb03f157b43e223d4d2767882218254ad74528a138c599ea545e",
    "l3_evaluator_build_hash": "eb0ffb44f0b47c1fcfaa598e95a1a6ffdae963dd37ab0b64f988794c3398bb92",
    "l3_runtime_lock_sha256": "5cd587bf0f862ab1bc60c988f151d4424c217ad236f8845c49bd488d5bd21820",
    "mesh_study_sha256": null,
    "nominal_reference_step_sha256": "c660bf472a9532f98099dce063f0c62968f6a2f89349d2e4aaa2fe5c048fb88b",
    "reference_base_result_sha256": "2f3f1eaaa8f0c13e6aa5879cbcaa31a0d8fda1438a5f73d2cec067501aa8ddf1"
  },
  "contract_id": "p_fusion360_001312:l3-response:v1",
  "contract_sha256": "9db3ec1763db5292bab429b2ed220a165c8ec6eb2bc097a3ff17443249cef6c3",
  "engineering_requirements": {
    "maximum_candidate_reference_compliance_ratio": 1.25,
    "maximum_candidate_reference_displacement_ratio": 1.25,
    "maximum_normalized_displacement": 0.02,
    "maximum_regularized_von_mises_p95_mpa": 125.0,
    "maximum_stress_utilization": 1.0
  },
  "evaluator": {
    "build_hash": "58bc486b6f38458a6a68951c1ec66625c91d774b7eca1acc7a4b837030f500d8",
    "name": "cadengbench-p-l3-response",
    "version": "0.1.0"
  },
  "fidelity": {
    "aggregate": "geometric_mean",
    "base_maximum_symmetric_log_error": {
      "normalized_compliance": 0.22314355131420976,
      "normalized_max_displacement": 0.22314355131420976,
      "regularized_von_mises_p95_mpa": 0.22314355131420976
    },
    "component_score": "exp_negative_normalized_log_error",
    "effective_maximum_symmetric_log_error": {
      "normalized_compliance": 0.22314355131420976,
      "normalized_max_displacement": 0.22314355131420976,
      "regularized_von_mises_p95_mpa": 0.22314355131420976
    },
    "mesh_symmetric_log_uncertainty": {
      "normalized_compliance": 0.0,
      "normalized_max_displacement": 0.0,
      "regularized_von_mises_p95_mpa": 0.0
    },
    "metrics": [
      "regularized_von_mises_p95_mpa",
      "normalized_max_displacement",
      "normalized_compliance"
    ]
  },
  "item_id": "p_fusion360_001312",
  "loading": {
    "base_loaded_area_mm2": 706.8583470577036,
    "base_resultant_force_n": [
      0.0,
      70.68583470577036,
      0.0
    ],
    "base_traction_vector_mpa": [
      0.0,
      0.1,
      0.0
    ],
    "control": "fixed_resultant_force",
    "controlling_constraint": "stress_utilization",
    "load_scale": 624.6893687610316,
    "predicted_reference_traction_vector_mpa": [
      0.0,
      62.46893687610316,
      0.0
    ],
    "target_resultant_force_n": [
      0.0,
      44156.6894626943,
      0.0
    ]
  },
  "material": {
    "allowable_stress_mpa": 125.0,
    "model": "linear_elastic_isotropic",
    "poisson_ratio": 0.33,
    "safety_factor": 2.0,
    "yield_strength_mpa": 250.0,
    "youngs_modulus_mpa": 70000.0
  },
  "numerical": {
    "maximum_equilibrium_relative_error": 5e-05,
    "maximum_force_control_relative_error": 1e-05,
    "maximum_linearity_relative_error": 0.02,
    "ratio_epsilon": 1e-12
  },
  "profile": {
    "profile_id": "cadengbench-p-l3-response-v1",
    "profile_sha256": "0b0a1e0e7338c0836b45f76622bf144e7bfd658ac80237c0fa68861bbd274d11",
    "status": "calibrated"
  },
  "reference_base": {
    "metrics": {
      "force_equilibrium_relative_error": 4.975440019255087e-08,
      "normalized_compliance": 126.8896999369812,
      "normalized_max_displacement": 1.425178604276239e-06,
      "regularized_von_mises_p95_mpa": 0.1000497257124104
    },
    "predicted_scaled_metrics": {
      "force_equilibrium_relative_error": 4.975440019255087e-08,
      "normalized_compliance": 126.8896999369812,
      "normalized_max_displacement": 0.0008902939226770519,
      "regularized_von_mises_p95_mpa": 62.5
    }
  },
  "scenario": "axial_tension",
  "schema_version": "cadengbench-p.l3-response-contract.v1",
  "source_intent_claimed": false,
  "status": "calibrated",
  "threshold_authority": "benchmark_assigned_reference_relative_calibrated_v1"
}
